{
  "version": 1,
  "id": "evt_result_available_01",
  "ts": "2026-07-26T18:45:00-04:00",
  "type": "agent.result.available",
  "source": "djinn",
  "actor": "djinn",
  "orchestration_id": "coven-djinn-roadmap-2026-07-26",
  "task_id": "review-diff",
  "agent_ref": {
    "orchestration_id": "coven-djinn-roadmap-2026-07-26",
    "task_id": "review-diff",
    "agent_id": "reviewer-1",
    "harness": "djinn",
    "native_session_id": "agt_child",
    "transcript_uri": "djinn://sessions/agt_child",
    "result_uri": "file://$COVEN_DIR/results/reviewer-1-summary.md"
  },
  "runtime_ref": {
    "harness": "djinn",
    "native_session_id": "agt_child",
    "status": "completed"
  },
  "correlation_id": "cmd_review_diff_01",
  "payload": {
    "summary": "Found two high-priority risks and one medium-priority follow-up.",
    "result_uri": "file://$COVEN_DIR/results/reviewer-1-summary.md",
    "transcript_uri": "djinn://sessions/agt_child",
    "recommended_actions": [
      "open",
      "import_summary",
      "continue_parent"
    ]
  }
}
